{"limits":{"max_aggregate_collection_bytes":268435456,"max_collection_members":256,"max_file_bytes":67108864,"max_open_files":256,"max_processes":16,"max_projection_bytes":134217728,"max_replay_units":100000,"max_stderr_bytes":1048576,"max_stdout_bytes":1048576,"max_subprocess_seconds":600,"max_temporary_disk_bytes":1073741824},"policy_identifier":"experiment-evidence-preparation-policy-v1","policy_identity":"e075147c042533aebe99b433e9626c2426a55f19086671e850a621dfdb424014","profile_renderer_identity":"1666f302d171d7f062583852cacc623a509f1fc7d1d73910f4085bb9a21732df","schema_version":1,"worker_profiles":[{"allowed_read_roles":["closed_dependencies","detached_source","exact_raw_input","private_request","system_runtime"],"allowed_write_roles":["private_output","private_temp"],"commands":["project_canonical_jsonl"],"denied_roles":["attempt_control_roots","mutable_input_locators","network","projector_unrelated_raw_objects","ranking_evaluation_roots"],"module":"src/orev3/execution/input_projection_worker.py","network_policy":"prohibited","sandbox_template_identity":"da32e88508820e8034d1ab8570b9fdbbf0f85a9817a5401a8821c7ef4a215d7c","sandbox_template_revision":"macos-seatbelt-capability-v4","worker_kind":"INPUT_PROJECTOR"},{"allowed_read_roles":["artifact_store","detached_source","private_request","system_runtime"],"allowed_write_roles":["closed_dependency_root","private_temp"],"commands":["validate_imports","validate_runtime"],"denied_roles":["network","phase3b_scientific_inputs"],"module":"src/orev3/execution/preparation_worker.py","network_policy":"prohibited","sandbox_template_identity":"e55dba9a5ec1fb87d8237cd95c8a29dd49c0919fc7380c38678ee6669a3ed7bc","sandbox_template_revision":"phase3a-network-sandbox-v1","worker_kind":"PHASE3A_VALIDATOR"},{"allowed_read_roles":["closed_dependencies","detached_source","private_request","system_runtime"],"allowed_write_roles":["private_temp"],"commands":["collect","run_exact"],"denied_roles":["attempt_control_roots","mutable_input_locators","network","projection_store","raw_input_store"],"module":"src/orev3/execution/readiness_test_worker.py","network_policy":"prohibited","sandbox_template_identity":"8c658cb44644339b66664c180412425ca6e4b0f8c4f8e69b57839cc811c3c1ab","sandbox_template_revision":"macos-seatbelt-capability-v4","worker_kind":"READINESS_TEST"},{"allowed_read_roles":["closed_dependencies","detached_source","exact_projection","private_request","system_runtime"],"allowed_write_roles":["private_output","private_temp"],"commands":["reconstruct_replay"],"denied_roles":["attempt_control_roots","mutable_input_locators","network","projector_private_temp","raw_input_store","raw_parser_capability","unrelated_projection_objects"],"module":"src/orev3/execution/replay_preparation_worker.py","network_policy":"prohibited","sandbox_template_identity":"b8d06f8178a51f31a9156f466af1391c0fadac43450f2d0ba85195219dc1f514","sandbox_template_revision":"macos-seatbelt-capability-v4","worker_kind":"REPLAY_PREPARATION"}]}
